Id,Date,All Day,Title,Symbol,Impact,Forecast,Previous
2020.11.26USDBank Holiday,11/26/20 0:00,TRUE,Bank Holiday,USD,4," "," "
2020.11.26AUDPrivate Capital Expenditure q q,11/26/20 0:30,FALSE,Private Capital Expenditure q/q,AUD,2,-1.5%,-6.4%
2020.11.26EURGerman GfK Consumer Climate,11/26/20 7:00,FALSE,German GfK Consumer Climate,EUR,1,-4.9,-3.2
2020.11.26EURM3 Money Supply y y,11/26/20 9:00,FALSE,M3 Money Supply y/y,EUR,1,10.4%,10.4%
2020.11.26EURPrivate Loans y y,11/26/20 9:00,FALSE,Private Loans y/y,EUR,1,3.1%,3.1%
2020.11.26EURECB Monetary Policy Meeting Accounts,11/26/20 12:30,FALSE,ECB Monetary Policy Meeting Accounts,EUR,1," "," "
2020.11.26JPYTokyo Core CPI y y,11/26/20 23:30,FALSE,Tokyo Core CPI y/y,JPY,1,-0.6%,-0.5%

