Id,Date,All Day,Title,Symbol,Impact,Forecast,Previous
2016.04.18GBPRightmove HPI m m,4/18/16 0:01,FALSE,Rightmove HPI m/m,GBP,1," ",1.3%
2016.04.18AUDNew Motor Vehicle Sales m m,4/18/16 2:30,FALSE,New Motor Vehicle Sales m/m,AUD,1," ",0.0%
2016.04.18EURGerman Buba Monthly Report,4/18/16 11:00,FALSE,German Buba Monthly Report,EUR,1," "," "
2016.04.18CADForeign Securities Purchases,4/18/16 13:30,FALSE,Foreign Securities Purchases,CAD,2,7.52B,11.41B
2016.04.18USDFOMC Member Dudley Speaks,4/18/16 13:30,FALSE,FOMC Member Dudley Speaks,USD,2," "," "
2016.04.18USDNAHB Housing Market Index,4/18/16 14:21,FALSE,NAHB Housing Market Index,USD,1,59,58
2016.04.18AUDCB Leading Index m m,4/18/16 15:30,FALSE,CB Leading Index m/m,AUD,1," ",-0.4%
2016.04.18NZDBusinessNZ Services Index,4/18/16 22:30,FALSE,BusinessNZ Services Index,NZD,1," ",57.2

