Id,Date,All Day,Title,Symbol,Impact,Forecast,Previous
2020.09.22AUDRBA Deputy Gov Debelle Speaks,9/22/20 1:30,FALSE,RBA Deputy Gov Debelle Speaks,AUD,1," "," "
2020.09.22GBPBOE Gov Bailey Speaks,9/22/20 8:30,FALSE,BOE Gov Bailey Speaks,GBP,3," "," "
2020.09.22GBPCBI Industrial Order Expectations,9/22/20 11:00,FALSE,CBI Industrial Order Expectations,GBP,1,-32,-44
2020.09.22CNYCB Leading Index m m,9/22/20 14:00,FALSE,CB Leading Index m/m,CNY,1," ",0.7%
2020.09.22EURConsumer Confidence,9/22/20 14:44,FALSE,Consumer Confidence,EUR,1,-15,-15
2020.09.22USDRichmond Manufacturing Index,9/22/20 14:59,FALSE,Richmond Manufacturing Index,USD,1,12,18
2020.09.22USDExisting Home Sales,9/22/20 15:00,FALSE,Existing Home Sales,USD,1,6.05M,5.86M
2020.09.22USDFed Chair Powell Testifies,9/22/20 15:30,FALSE,Fed Chair Powell Testifies,USD,3," "," "

