Id,Date,All Day,Title,Symbol,Impact,Forecast,Previous
2017.05.26AllG7 Meetings,5/26/17 0:00,TRUE,G7 Meetings,All,3," "," "
2017.05.26JPYNational Core CPI y y,5/26/17 0:30,FALSE,National Core CPI y/y,JPY,1,0.4%,0.2%
2017.05.26JPYTokyo Core CPI y y,5/26/17 0:30,FALSE,Tokyo Core CPI y/y,JPY,1,0.0%,-0.1%
2017.05.26JPYSPPI y y,5/26/17 0:50,FALSE,SPPI y/y,JPY,1,0.9%,0.8%
2017.05.26USDCore Durable Goods Orders m m,5/26/17 13:30,FALSE,Core Durable Goods Orders m/m,USD,3,0.4%,0.0%
2017.05.26USDDurable Goods Orders m m,5/26/17 13:30,FALSE,Durable Goods Orders m/m,USD,2,-1.4%,0.9%
2017.05.26USDPrelim GDP Price Index q q,5/26/17 13:30,FALSE,Prelim GDP Price Index q/q,USD,1,2.3%,2.3%
2017.05.26USDPrelim GDP q q,5/26/17 13:30,FALSE,Prelim GDP q/q,USD,3,0.9%,0.7%
2017.05.26USDRevised UoM Consumer Sentiment,5/26/17 15:00,FALSE,Revised UoM Consumer Sentiment,USD,2,97.6,97.7
2017.05.26USDRevised UoM Inflation Expectations,5/26/17 15:00,FALSE,Revised UoM Inflation Expectations,USD,1," ",2.6%

