Id,Date,All Day,Title,Symbol,Impact,Forecast,Previous
2014.10.28JPYRetail Sales y y,10/28/14 0:50,FALSE,Retail Sales y/y,JPY,2,0.9%,1.2%
2014.10.28EURGerman Import Prices m m,10/28/14 8:00,FALSE,German Import Prices m/m,EUR,1,-0.1%,-0.1%
2014.10.28USDCore Durable Goods Orders m m,10/28/14 13:30,FALSE,Core Durable Goods Orders m/m,USD,3,0.5%,0.4%
2014.10.28USDDurable Goods Orders m m,10/28/14 13:30,FALSE,Durable Goods Orders m/m,USD,2,0.4%,-18.4%
2014.10.28USDS&P CS Composite-20 HPI y y,10/28/14 14:00,FALSE,S&P/CS Composite-20 HPI y/y,USD,1,5.7%,6.7%
2014.10.28USDRichmond Manufacturing Index,10/28/14 14:59,FALSE,Richmond Manufacturing Index,USD,1,11,14
2014.10.28USDCB Consumer Confidence,10/28/14 15:00,FALSE,CB Consumer Confidence,USD,3,87.4,89.0
2014.10.28GBPMPC Member Cunliffe Speaks,10/28/14 18:30,FALSE,MPC Member Cunliffe Speaks,GBP,2," "," "

